{
  "schemaVersion": "1.8",
  "kind": "audit-manifest",
  "tool": "go-FuSa",
  "toolVersion": "0.23.0",
  "language": "go",
  "generatedAt": "2026-06-10T12:00:00Z",
  "module": "github.com/SoundMatt/go-FuSa",
  "files": [
    { "path": "check-report.json",     "size": 1234, "sha256": "a1b2c3d4e5f6a1b2c3d4e5f6a1b2c3d4e5f6a1b2c3d4e5f6a1b2c3d4e5f6a1b2" },
    { "path": "qualify-report.json",   "size": 567,  "sha256": "b2c3d4e5f6a1b2c3d4e5f6a1b2c3d4e5f6a1b2c3d4e5f6a1b2c3d4e5f6a1b2c3" },
    { "path": "sbom.json",             "size": 890,  "sha256": "c3d4e5f6a1b2c3d4e5f6a1b2c3d4e5f6a1b2c3d4e5f6a1b2c3d4e5f6a1b2c3d4" },
    { "path": "trace-matrix.json",     "size": 432,  "sha256": "d4e5f6a1b2c3d4e5f6a1b2c3d4e5f6a1b2c3d4e5f6a1b2c3d4e5f6a1b2c3d4e5" },
    { "path": ".fusa.json",            "size": 120,  "sha256": "e5f6a1b2c3d4e5f6a1b2c3d4e5f6a1b2c3d4e5f6a1b2c3d4e5f6a1b2c3d4e5f6" },
    { "path": ".fusa-reqs.json",       "size": 980,  "sha256": "f6a1b2c3d4e5f6a1b2c3d4e5f6a1b2c3d4e5f6a1b2c3d4e5f6a1b2c3d4e5f6a1" }
  ]
}
